{
  "$schema": "../schemas/compatibility.schema.json",
  "schemaVersion": 1,
  "updatedAt": "2026-08-30",
  "components": [
    {
      "kind": "ollama",
      "displayName": "Ollama",
      "minimumVersion": "0.12.0",
      "maximumVersionExclusive": "0.34.0",
      "recommendedVersion": "0.33.2",
      "source": "https://github.com/ollama/ollama/releases/tag/v0.33.2"
    },
    {
      "kind": "harness",
      "displayName": "DeepSeek Harness",
      "minimumVersion": "0.1.1-rc.2",
      "maximumVersionExclusive": "0.2.0",
      "recommendedVersion": "0.1.1-rc.2",
      "source": "https://www.npmjs.com/package/@deepseek-ai/dsh/v/0.1.1-rc.2"
    }
  ],
  "artifacts": [
    {
      "kind": "ollama",
      "version": "0.33.2",
      "operatingSystem": "windows",
      "architecture": "x86_64",
      "url": "https://github.com/ollama/ollama/releases/download/v0.33.2/ollama-windows-amd64.zip",
      "sha256": "2439cbea65310b1aadf7d8fc41d7faf5d033f920d42e00a476c58bf9bff6950e",
      "downloadSize": 1460134793,
      "maximumExtractedSize": 8000000000,
      "archiveFormat": "zip",
      "executableRelativePath": "ollama.exe"
    }
  ]
}
